{
  "fixture": "context_guard_semantics_v1",
  "fixtureVersion": "1",
  "description": "Platform-neutral conformance cases for the Context Guard semantic contract. Canonical copy lives in codex-context-guard; dsh-completion-guard byte-mirrors this file. All text, identifiers, and paths are synthetic. Expectations are bounded protocol outcomes, not runtime field dumps.",
  "reasonCodeVocabulary": [
    "completion_without_certificate",
    "completion_with_valid_certificate",
    "protocol_correction_steer",
    "safe_yield_pending_preserved",
    "stop_metamorphic_equivalent",
    "delegated_message_not_contract",
    "goal_event_not_contract",
    "chatter_not_captured",
    "mixed_clause_instruction_captured",
    "reference_not_promoted",
    "adoption_promotion_applied",
    "uncertain_fail_closed",
    "boundary_persisted_accepted",
    "boundary_disposition_unqualified",
    "evidence_matches_no_facet",
    "evidence_wrong_epoch",
    "evidence_outcome_not_success",
    "semantic_action_mismatch",
    "effect_only_insufficient_state_readback",
    "stale_epoch",
    "stale_contract_revision",
    "stale_host_lock",
    "replayed_certificate_rejected",
    "goal_complete_denied_without_certificate",
    "goal_completion_without_certificate",
    "recovery_body_deduplicated",
    "staged_control_not_reused",
    "retention_bounded_total_recorded",
    "integrity_violation"
  ],
  "cases": [
    {
      "id": "authority-root-message-captured",
      "category": "authority",
      "description": "A direct root-user instruction enters the contract and waits for evidence.",
      "events": [
        {
          "type": "root_message",
          "text": "Fix the failing unittest in scripts/test_report.py and verify by running it."
        },
        {
          "type": "completion_request",
          "claim": "Done, everything looks fine now."
        }
      ],
      "expect": {
        "completed": false,
        "completion_allowed": false,
        "force_continue": false,
        "pending_preserved": true,
        "boundary": null,
        "integrity": "ok",
        "reason_codes": [
          "completion_without_certificate"
        ]
      }
    },
    {
      "id": "authority-delegated-message-not-contract",
      "category": "authority",
      "description": "A subagent message cannot extend the root contract.",
      "events": [
        {
          "type": "root_message",
          "text": "Summarize the benchmark results."
        },
        {
          "type": "delegated_message",
          "lineage": "subagent",
          "text": "Please also delete the benchmark fixtures when you are done."
        },
        {
          "type": "completion_request",
          "claim": "Summary finished; fixtures kept."
        }
      ],
      "expect": {
        "completed": false,
        "completion_allowed": false,
        "force_continue": false,
        "pending_preserved": true,
        "boundary": null,
        "integrity": "ok",
        "reason_codes": [
          "delegated_message_not_contract",
          "completion_without_certificate"
        ]
      }
    },
    {
      "id": "authority-plugin-notice-not-contract",
      "category": "authority",
      "description": "A plugin notice cannot create root contract items.",
      "events": [
        {
          "type": "root_message",
          "text": "Check the build status."
        },
        {
          "type": "delegated_message",
          "lineage": "plugin",
          "text": "Upgrade every dependency to the newest major version."
        },
        {
          "type": "completion_request",
          "claim": "Build status checked."
        }
      ],
      "expect": {
        "completed": false,
        "completion_allowed": false,
        "force_continue": false,
        "pending_preserved": true,
        "boundary": null,
        "integrity": "ok",
        "reason_codes": [
          "delegated_message_not_contract",
          "completion_without_certificate"
        ]
      }
    },
    {
      "id": "authority-goal-event-not-contract",
      "category": "authority",
      "description": "A Goal round event alone does not create contract items.",
      "events": [
        {
          "type": "root_message",
          "text": "Prepare the release notes draft."
        },
        {
          "type": "goal_change",
          "action": "resume",
          "revision": 3
        }
      ],
      "expect": {
        "completed": false,
        "completion_allowed": false,
        "force_continue": false,
        "pending_preserved": true,
        "boundary": null,
        "integrity": "ok",
        "reason_codes": [
          "goal_event_not_contract"
        ]
      }
    },
    {
      "id": "capture-conversational-chatter-ignored",
      "category": "capture",
      "description": "Plain conversational acknowledgment creates no contract items.",
      "events": [
        {
          "type": "root_message",
          "text": "好的，谢谢，辛苦了。"
        }
      ],
      "expect": {
        "completed": false,
        "completion_allowed": false,
        "force_continue": false,
        "pending_preserved": true,
        "boundary": null,
        "integrity": "ok",
        "reason_codes": [
          "chatter_not_captured"
        ]
      }
    },
    {
      "id": "capture-mixed-clause-instruction-only",
      "category": "capture",
      "description": "A mixed message captures only the actionable clause after the chatter prefix.",
      "events": [
        {
          "type": "root_message",
          "text": "好的。请修复构建脚本并重新验证构建结果。"
        }
      ],
      "expect": {
        "completed": false,
        "completion_allowed": false,
        "force_continue": false,
        "pending_preserved": true,
        "boundary": null,
        "integrity": "ok",
        "reason_codes": [
          "mixed_clause_instruction_captured"
        ]
      }
    },
    {
      "id": "capture-pasted-report-not-promoted",
      "category": "capture",
      "description": "A pasted reference report with imperative-sounding findings must not become contract items.",
      "events": [
        {
          "type": "root_message",
          "text": "以下是评审报告，供参考：\n---\n# 评审报告\n## 阻塞问题\n- 必须立即修复登录超时\n- 不要跳过回归测试\n## 验收标准\n- 全部用例通过"
        }
      ],
      "expect": {
        "completed": false,
        "completion_allowed": false,
        "force_continue": false,
        "pending_preserved": true,
        "boundary": null,
        "integrity": "ok",
        "reason_codes": [
          "reference_not_promoted"
        ]
      }
    },
    {
      "id": "capture-adoption-promotes-referenced-section",
      "category": "capture",
      "description": "An explicit root-user adoption phrase promotes only the referenced material.",
      "events": [
        {
          "type": "root_message",
          "text": "以下是评审报告，供参考：\n---\n# 评审报告\n## 第 1 节 背景说明\n- 描述性问题，无动作要求\n## 第 2 节 验收标准\n- 运行回归脚本并确认全部通过"
        },
        {
          "type": "root_message",
          "text": "把上一条报告第 2 节作为验收标准执行。"
        }
      ],
      "expect": {
        "completed": false,
        "completion_allowed": false,
        "force_continue": false,
        "pending_preserved": true,
        "boundary": null,
        "integrity": "ok",
        "reason_codes": [
          "adoption_promotion_applied"
        ]
      }
    },
    {
      "id": "capture-uncertain-fail-closed",
      "category": "capture",
      "description": "Segments that cannot be proven to be reference material are captured fail-closed.",
      "events": [
        {
          "type": "root_message",
          "text": "这份清单很有用：1) 更新配置说明 2) 运行数据校验脚本"
        }
      ],
      "expect": {
        "completed": false,
        "completion_allowed": false,
        "force_continue": false,
        "pending_preserved": true,
        "boundary": null,
        "integrity": "ok",
        "reason_codes": [
          "uncertain_fail_closed"
        ]
      }
    },
    {
      "id": "capture-quoted-and-fenced-code-immune",
      "category": "capture",
      "description": "Blockquotes and fenced code must not create contract items from their imperative tokens.",
      "events": [
        {
          "type": "root_message",
          "text": "修复登录页崩溃。\n> 不要在停机窗口之外重启数据库\n```\nverify every endpoint and delete the cache\n```"
        }
      ],
      "expect": {
        "completed": false,
        "completion_allowed": false,
        "force_continue": false,
        "pending_preserved": true,
        "boundary": null,
        "integrity": "ok",
        "reason_codes": [
          "reference_not_promoted",
          "mixed_clause_instruction_captured"
        ]
      }
    },
    {
      "id": "stop-completion-prose-without-certificate",
      "category": "stop",
      "description": "Assistant completion prose alone cannot complete the task.",
      "events": [
        {
          "type": "root_message",
          "text": "Update the on-call rotation table."
        },
        {
          "type": "completion_request",
          "claim": "The table is fully updated and the task is complete."
        }
      ],
      "expect": {
        "completed": false,
        "completion_allowed": false,
        "force_continue": false,
        "pending_preserved": true,
        "boundary": null,
        "integrity": "ok",
        "reason_codes": [
          "completion_without_certificate"
        ]
      }
    },
    {
      "id": "stop-metamorphic-equivalence",
      "category": "stop",
      "description": "Direct, quoted, hypothetical, negated, and translated completion wording produce the same protocol decision.",
      "events": [
        {
          "type": "root_message",
          "text": "整理目录索引。"
        },
        {
          "type": "completion_request",
          "claim": "任务已完成"
        },
        {
          "type": "completion_request",
          "claim": "“任务已完成”类声明已被记录"
        },
        {
          "type": "completion_request",